{
  "suite_version": "2026-02-07-draft-v1",
  "implementation": {
    "id": "amp-rust-reference",
    "version": "0.1.0",
    "repository": "https://example.invalid/amp-rust-reference",
    "commit": "draft-2026-02-10-core"
  },
  "run": {
    "executed_at": "2026-02-10T12:00:00Z",
    "environment": {
      "os": "macos-15",
      "arch": "arm64",
      "runtime": "rust-1.85.0",
      "notes": "draft core profile run"
    }
  },
  "results": [
    {
      "vector_id": "001:A.2",
      "status": "pass"
    },
    {
      "vector_id": "001:A.3",
      "status": "pass"
    },
    {
      "vector_id": "001:A.5",
      "status": "pass"
    },
    {
      "vector_id": "001:A.6",
      "status": "pass"
    },
    {
      "vector_id": "001:A.8",
      "status": "pass"
    },
    {
      "vector_id": "001:A.9",
      "status": "pass"
    },
    {
      "vector_id": "001:A.10",
      "status": "pass"
    },
    {
      "vector_id": "001:A.11",
      "status": "pass"
    },
    {
      "vector_id": "002:A.1",
      "status": "pass"
    },
    {
      "vector_id": "002:A.2",
      "status": "pass"
    },
    {
      "vector_id": "002:A.4",
      "status": "pass"
    },
    {
      "vector_id": "002:A.6",
      "status": "pass"
    },
    {
      "vector_id": "002:A.13",
      "status": "pass"
    },
    {
      "vector_id": "002:A.14",
      "status": "pass"
    },
    {
      "vector_id": "003:A.1",
      "status": "pass"
    },
    {
      "vector_id": "003:A.2",
      "status": "pass"
    },
    {
      "vector_id": "003:A.3",
      "status": "pass"
    },
    {
      "vector_id": "004:A.2",
      "status": "pass"
    },
    {
      "vector_id": "004:A.18",
      "status": "pass"
    },
    {
      "vector_id": "004:A.19",
      "status": "pass"
    },
    {
      "vector_id": "004:A.15",
      "status": "pass"
    },
    {
      "vector_id": "004:A.23",
      "status": "pass"
    },
    {
      "vector_id": "005:A.4",
      "status": "pass"
    },
    {
      "vector_id": "005:A.14",
      "status": "pass"
    },
    {
      "vector_id": "005:A.20",
      "status": "pass"
    },
    {
      "vector_id": "006:A.2",
      "status": "pass"
    },
    {
      "vector_id": "006:A.3",
      "status": "pass"
    },
    {
      "vector_id": "006:A.4",
      "status": "pass"
    },
    {
      "vector_id": "006:A.17",
      "status": "pass"
    }
  ]
}
