{
  "suite_version": "2026-02-07-draft-v1",
  "implementation": {
    "id": "amp-rust-reference",
    "version": "0.1.0",
    "repository": "https://example.invalid/amp-rust-reference",
    "commit": "deadbeef"
  },
  "run": {
    "executed_at": "2026-02-07T12:00:00Z",
    "environment": {
      "os": "macos-15",
      "arch": "arm64",
      "runtime": "rust-1.85.0",
      "notes": "offline mode; local DID resolver fixtures"
    }
  },
  "results": [
    { "vector_id": "001:A.2", "status": "pass" },
    { "vector_id": "001:A.3", "status": "pass" },
    { "vector_id": "001:A.5", "status": "pass" },
    { "vector_id": "001:A.6", "status": "pass" },
    { "vector_id": "001:A.8", "status": "pass" },
    { "vector_id": "001:A.9", "status": "pass" },
    { "vector_id": "001:A.10", "status": "pass" },
    { "vector_id": "001:A.11", "status": "pass" },
    { "vector_id": "002:A.1", "status": "pass" },
    { "vector_id": "002:A.2", "status": "pass" },
    { "vector_id": "002:A.4", "status": "pass" },
    { "vector_id": "002:A.6", "status": "pass" },
    { "vector_id": "002:A.13", "status": "pass" },
    { "vector_id": "002:A.14", "status": "pass" },
    { "vector_id": "003:A.1", "status": "pass" },
    { "vector_id": "003:A.2", "status": "pass" },
    { "vector_id": "003:A.3", "status": "pass" },
    { "vector_id": "004:A.2", "status": "pass" },
    { "vector_id": "004:A.18", "status": "pass" },
    { "vector_id": "004:A.19", "status": "pass" },
    { "vector_id": "004:A.15", "status": "pass" },
    { "vector_id": "004:A.23", "status": "pass" },
    { "vector_id": "005:A.4", "status": "pass" },
    { "vector_id": "005:A.14", "status": "pass" },
    { "vector_id": "005:A.20", "status": "pass" },
    { "vector_id": "006:A.2", "status": "pass" },
    { "vector_id": "006:A.3", "status": "pass" },
    { "vector_id": "006:A.4", "status": "pass" },
    { "vector_id": "006:A.17", "status": "pass" },

    { "vector_id": "001:A.12", "status": "skip", "notes": "Optional RFC 001 MIME-diversity vector not implemented in this run" },
    { "vector_id": "002:A.9", "status": "skip", "notes": "Optional RFC 002 federation profile vector not implemented in this run" },
    { "vector_id": "003:A.5", "status": "skip", "notes": "Optional federation profile vector not implemented in this run" },
    { "vector_id": "006:A.15", "status": "skip", "notes": "Optional independent thread profile not implemented in this run" },
    { "vector_id": "007:A.17a", "status": "skip", "notes": "Optional extension RFC 007 not implemented in this run" },
    { "vector_id": "007:A.18", "status": "skip", "notes": "Optional extension RFC 007 not implemented in this run" },
    { "vector_id": "007:A.21", "status": "skip", "notes": "Optional extension RFC 007 not implemented in this run" },
    { "vector_id": "008:A.4", "status": "skip", "notes": "Optional extension RFC 008 not implemented in this run" },
    { "vector_id": "008:A.8", "status": "skip", "notes": "Optional extension RFC 008 not implemented in this run" },
    { "vector_id": "008:A.9", "status": "skip", "notes": "Optional extension RFC 008 not implemented in this run" },
    { "vector_id": "009:A.9", "status": "skip", "notes": "Optional extension RFC 009 not implemented in this run" },
    { "vector_id": "009:A.10", "status": "skip", "notes": "Optional extension RFC 009 not implemented in this run" },
    { "vector_id": "009:A.14", "status": "skip", "notes": "Optional extension RFC 009 not implemented in this run" },
    { "vector_id": "009:A.15", "status": "skip", "notes": "Optional extension RFC 009 not implemented in this run" },
    { "vector_id": "009:A.16", "status": "skip", "notes": "Optional extension RFC 009 not implemented in this run" },
    { "vector_id": "009:A.17", "status": "skip", "notes": "Optional extension RFC 009 not implemented in this run" },
    { "vector_id": "009:A.18", "status": "skip", "notes": "Optional extension RFC 009 not implemented in this run" },
    { "vector_id": "009:A.19", "status": "skip", "notes": "Optional extension RFC 009 not implemented in this run" },
    { "vector_id": "009:A.20", "status": "skip", "notes": "Optional extension RFC 009 not implemented in this run" },
    { "vector_id": "009:A.21", "status": "skip", "notes": "Optional extension RFC 009 not implemented in this run" },
    { "vector_id": "009:A.22", "status": "skip", "notes": "Optional extension RFC 009 not implemented in this run" },
    { "vector_id": "009:A.23", "status": "skip", "notes": "Optional extension RFC 009 not implemented in this run" },
    { "vector_id": "009:A.24", "status": "skip", "notes": "Optional extension RFC 009 not implemented in this run" },
    { "vector_id": "009:A.25", "status": "skip", "notes": "Optional extension RFC 009 not implemented in this run" },
    { "vector_id": "009:A.26", "status": "skip", "notes": "Optional extension RFC 009 not implemented in this run" },
    { "vector_id": "010:A.6", "status": "skip", "notes": "Optional extension RFC 010 not implemented in this run" },
    { "vector_id": "010:A.9", "status": "skip", "notes": "Optional extension RFC 010 not implemented in this run" },
    { "vector_id": "010:A.12", "status": "skip", "notes": "Optional extension RFC 010 not implemented in this run" },
    { "vector_id": "010:A.16", "status": "skip", "notes": "Optional extension RFC 010 not implemented in this run" },
    { "vector_id": "010:A.17", "status": "skip", "notes": "Optional extension RFC 010 not implemented in this run" },
    { "vector_id": "011:A.10", "status": "skip", "notes": "Optional extension RFC 011 not implemented in this run" },
    { "vector_id": "011:A.15", "status": "skip", "notes": "Optional extension RFC 011 not implemented in this run" },
    { "vector_id": "011:A.16", "status": "skip", "notes": "Optional extension RFC 011 not implemented in this run" },
    { "vector_id": "011:A.17", "status": "skip", "notes": "Optional extension RFC 011 not implemented in this run" },
    { "vector_id": "011:A.18", "status": "skip", "notes": "Optional extension RFC 011 not implemented in this run" },
    { "vector_id": "011:A.19", "status": "skip", "notes": "Optional extension RFC 011 not implemented in this run" },
    { "vector_id": "011:A.20", "status": "skip", "notes": "Optional extension RFC 011 not implemented in this run" },
    { "vector_id": "011:A.21", "status": "skip", "notes": "Optional extension RFC 011 not implemented in this run" },
    { "vector_id": "011:A.22", "status": "skip", "notes": "Optional extension RFC 011 not implemented in this run" },
    { "vector_id": "011:A.23", "status": "skip", "notes": "Optional extension RFC 011 not implemented in this run" }
  ]
}
